start	end	original_text
1523.0	1525.0	[Audience Laughter]
1525.0	1525.81	{James Deutsch} Yes, in the back.
1533.0	1541.0	<i>James Deutsch</i>: Yeah, the question is if I want to order an authentic Chinese dish, what might you recommend?--As authentically Chinese.
1541.0	1556.0	<i>Cedric Yeh</i>: I think the best way to say that is-- as Adriel mentioned, there are centers if--I try to stay away from this authenticity question because I think that's more of a question of cuisine and that's fine. If you are looking for that.
1556.0	1573.0	<i>Cedric Yeh</i>: My work and my studies have taken me towards like how the story progresses in terms of how the menu can be used as a timeline as we've mentioned earlier but, to answer your question, you would want to go to one of the centers where there are more new immigrants.
1573.0	1595.0	<i>Cedric Yeh</i>: So, their restaurants will be catering, like the early Chinese immigrants in the 1850s, to the community. So, if you go there and you order off the menu there, there is a chance that it's still is the menu that caters mainly to the people in the community and hasn't yet been experienced or adapted as a business, Adriel has also mentioned, to the takes of their cus- a wider range of customers.
1595.0	1618.0	<i>Cedric Yeh</i>: You probably wont get that in a regular restaurant. Most average restaurants are just going to have the menus that do well and asking won't really change anything. I would give you one cautionary tale. I had a friend of mine who did like to explore and enjoy and they went into a Chinese restaurant, it was down home.
1618.0	1632.0	<i>Cedric Yeh</i>: It had nothing but Chinese everywhere and they were like, 'This is where I want to be!' and they pointed at one item and they pointed at another and the waiter looked at them and said, 'Are you sure?' and they said, 'Come on, bring it on. I am not concerned.'
1632.0	1647.0	<i>Cedric Yeh</i>: They said, 'Look really, I am just asking. Really?' They're like, 'I am not afraid. I'm going to enjoy this, you just watch.' He came back with the same dish, they were on different parts of the menu. So, you know, just be cautious.
1647.0	1661.0	<i>Adriel Luis</i>: Yeah but, I mean, you'll find some restaurants where there is like the English menu and if you recognize everything on there, then you know you got like the menu for like the non-Chinese people and then like usually you'll see like all these Chinese characters like all over the wall.
1661.0	1695.0	<i>Adriel Luis</i>: Right? Like, if you point at something like that, there is probably a lot of dishes that- it's not necessarily that it's something that you find disgusting or anything but, it's something that often times these restaurant owners they, especially if they are catering towards Americans as well as Chinese customers, they'll have two separate menus and then they'll kind of like, based out of their own reference be like, 'Ok, you know,I'll put in English the things that I'm gonna assume that, you know, Americans are gonna want to eat and then I'm not even going to even bother translating the things that I'm gonna assume that their not gonna want to eat
1695.0	1726.0	<i>Adriel Luis</i>: but if you're interested in trying it and you're not worried about, you know like, you know, ending up with an unconventional body part which is typically what I prefer, I mean.  I know that if you do find something that is like kind of translated, like they were like having a really rough time trying to translate in English, that is probably more on the side of something that you'll get, you know, that a Chinese customer would order because, you know, like, they had like a really difficult time trying to explain it in English while still making it sound appetizing.
1726.0	1744.0	<i>Adriel Luis</i>: You could also just like order the english- the english translated item that sounds the most disgusting. It is probably the most delicious thing on the menu. And I will say yeah. Like, you know, everybody kind of knows the rule of like, if you go to a Chinese restaurant and you don't see any Chinese people eating there then you probably shouldn't eat there either.
1744.0	1778.0	"<i>Adriel Luis</i>: Sometimes like, my fiancee and I will like, try a restaurant and then we will see people like, look through the window and see us and come in and like, eat because they saw us and we are like, 'No no no, we're just trying this. It's actually not that good.' So, ehh. 
<i>Cedric Yeh</i>: Once again, I apologize to any Chinese restaurants we might be taking business away. I would like to point out once again, that you know, for my take it's food that we- it didn't get to 50,000 restaurants because we were looking for the one real one. We do have real ones, they're everywhere. All of those are real."
1778.0	1801.0	<i>Cedric Yeh</i>: There's no- like, you know, if you want to find something that has more um, authentic is such a loaded word. If you want to look for that, fine, but the Chinese restaurants that dot our landscape, they're perfectly fine, I enjoyed them growing up as much as I liked a Big Mac. So, you know, beef and broccoli is how my mom got me to eat vegetables.
1801.0	1813.0	<i>Cedric Yeh</i>: You know, and as Adriel said that's not, you can't find broccoli, they don't make that in China but I loved it so you know and keep on going, it's good stuff.
1813.0	1813.65	<i>James Deutsch</i>: Yes, question here.
1841.0	1849.0	<i>James Deutsch</i>: Yeah, her comment is that as a Chinese student when she goes to Chinese restaurants, she will tell the owner, you know, 'I want the food prepared in the Chinese way.'
1849.0	1851.0	<i>James Deutsch</i>: Yes, sir?
1851.0	1873.0	<i>Audience Member</i>: I was wondering if there was any sort of, like back--because you say the Chinese restaurants here started as like more homeland mainly in China. But how deep was that entrepreneurial spirit? I wonder if like there was any sort of backlash like, 'Oh, now you're cooking for Americans, you've sold out.' Was any of that like backlash? Or was that entrepreneurial spirit like so deep that they're like 'Oh no, go for it.'
1873.0	1880.0	<i>James Deutsch</i>: Yeah, the question is whether there was a backlash to the Chinese entrepreneurs creating Chinese restaurants.
1880.0	1894.0	<i>Cedric Yeh</i>: Um, I don't know, that's another one of those in that moment when they were first try-- But as Adriel was explaining and I mentioned briefly, that exclusionary period where Chinese restaurants really took hold was-- is hard to explain.
1894.0	1906.0	<i>Cedric Yeh</i>: It was devastating. Think about it. I mean, you all have your immigration stories. You know where your parents came from. You know that there's a background, there's a community they came from. Ah, Northern Europe, Africa, wherever it might be, Asia.
1906.0	1913.0	<i>Cedric Yeh</i>: But just imagine if they said 'no more.' Alright so that meant, in theory, those that were in this country were go-- they were di--
1913.0	1923.0	<i>Cedric Yeh</i>: Most of the ones who migrated here were men. They came here for work. You would eventually, after a generation or two, just, um, evaporate. There wasn't any-- no one else coming in.
1923.0	1945.0	<i>Cedric Yeh</i>: There was a trickle of high level, like, merchants and diplomats and things like that-- businessmen. But, your communities were almost all men, they were ostricized to begin with, now you have a law in place that says 'and if this is the one business you can do, you will do whatever it takes to stay open, to serve' and there's just this amazing- like I'm amazed at what was going on.
1945.0	1960.0	<i>Cedric Yeh</i>: But, Adriel mentioned chop suey. Chop suey was-- I like to think of it as a savior. Other scholars-- there's no real, um, documentation. But the rise of chop suey was right in the heart of that exclusionary period.
1960.0	1975.0	<i>Cedric Yeh</i>: Americans loved chop suey. There was an explosion of chop-chop houses, this is what they called them. They went from, say, New York as an example. The census-- it showed restaurants in, uh, the late 1890s, 1900s, there were maybe 40 Chinese restaurants.
1975.0	1993.0	<i>Cedric Yeh</i>: By the end-- the beginning of the 1900s, there were 200. Alright? And because people just absolutely had to have this. And it might have saved the community. It gave them an opportunity to survive when there really wasn't a lot of options.
1993.0	2001.8	"<i>Cedric Yeh</i>: But, you know, if you're just trying to stay alive, I don't think anybody would be saying 'Why are you serving that? That's not a--"" You know, he's just glad that he's making a buck."
2005.0	2012.0	<i>Speaker 1</i>: Yeah and I think also, I mean, also a lot of the entrepreneurs were sending money back to China, and so I don't think people in China were having a problem with that.
2012.0	2031.0	Uh, and I think also, I mean, the, the food, American Chinese food, uh, in many ways is just like so, so different from the types of cuisine that you would get in different parts of China that it didn't, it almost doesn't really feel like a bastardization.
2031.0	2042.0	And I think one of the things to clarify is like, you know, the first time I went to China, I was like concerned, I was like, China's so big and if it's all Chinese restaurants how do they all cook the same thing?
2042.0	2050.0	And I realized, you know like, China's such a huge country with so many regions and so there's not just like, there's no restaurant really that is like Chinese food.
2050.0	2062.0	You know you have Yunnan food, you have Sichuan food, you have Funan food, you have Hong Kong food, you have [[Mikou?]] food, you have Taiwanese food, and so, um, you know there, there is like a huge variety of restaurants.
2062.0	2068.0	You can go into a mall and there will be a food court of like 20 restaurants and they'll all serve different things even though they're all different kinds of Chinese food.
2068.0	2083.0	"And so, when you come out here, especially the restaurants that are catering towards Americans, uh, they're just still trying to wrap their heads around Chinese being you know like, one kind of Asian right, and so, you know, it's a long shot to be like, ""Nah, nah we're this kind of Chinese."""
2083.0	2097.0	And so as a result, I think that this kind of amalgamated Chinese food is something that like, no one particular region, I think, would feel personally offended about. I mean, that's an assumption on my hand.
2097.0	2113.0	I think as a result you kind of get- It almost feels like a top 40 sometimes when you look at the menu. You've got, like, Mongolian beef, right. You've got, like, Hunan shrimp. You've got all these food items that are named after one region as if in Mongolia all they eat is Mongolian beef.
2113.0	2137.9	And so, I think that, again, it was-- during the time, it's just like the validation. When you're in a period where there's just so much xenophobia, and then you actually start getting customers from the communities that have been ostracizing you, like that validation I think is enough to kind of override any feeling of people are trying to water down my culture.
2140.0	2143.0	<i>Speaker 1</i>: Other questions? Yes, sir?
2143.0	2155.0	<i>Speaker 2</i>: I was in New Mexico a couple of weeks ago and, uh, I stopped in a-- I stayed in a hotel, you know, and I, stayed in a hotel.
2155.0	2167.0	It was owned by some Chinese people and the free breakfast-- so for the breakfast it was, well, it wasn't lunch, y'know. It was just cereal and some milk and [[?]].
2167.0	2181.0	And then they had some strange-looking pastries, it was sort of like spirals, in a hard little encasement sort of thing, and it kind of made me wonder what what is the uh, in Chinese cuisine, is there a breakfast tradition?
2181.0	2190.0	Or [[?]] So, uh, what is the Chinese tradition for breakfast?
2190.0	2200.0	<i>Speaker 1</i>: Yea the question is uh, based on his experience at a a hotel in Mexico, wondering about what might be a traditional Chinese breakfast?
2200.0	2216.0	"] 
<i>Speaker 3</i>: It's a lot different, sort of, than here, although the oatmeal, it's not oatmeal, just watery rice, now that could be, you would be like, ""hey, that's like oatmeal!"" But yes, they have pastries, it's usually, the places in China that I went too, it's usually kind of salty."
2216.0	2234.0	They'll be snacks, not snacks, little dishes of salted vegetables, maybe some peanuts, pickles, pickled vegetables, things like that, a version of oatmeal [[?]] rice, some pastries.
2234.0	2238.0	And I'm trying to remember, err, you've been there more recently, did you have a lot of breakfast?
2238.0	2314.0	"<i>Speaker 4</i>: Yeah, it'll usually be kinda greasy, really greasy stuff. Uh, I mean, especially from Hong Kong, you have like, if you ever, you know like you see the Congee, which is like the rice porridge. And then they'll serve it with like, they usually call it, in America they'll call it like ""fried Chinese donut."" It's like, quite delicious 'cuz it's fried dough, but, have you seen Mulan? You've seen Mulan. I've seen Mulan, right. And uh, like there's that seen where like the Eddie Murphy dragon is like, being like, ""Breakfast time, Mulan!"" And then this like, a bowl of rice with like eggs and bacon. It's like, that's not what they eat in China. So, yeah, I mean, I think pastries is something that Chinese folks, particularly, I mean definitely, in Hong Kong, because of the European influence, like, they definitely take it on. So, you have like these egg custard tarts, you know Chinese wedding cake is like, you see this influence from Western culture, Parisian culture, things like that. But pastries themselves have not necessarily been something that had been customarily a breakfast dish. It will typically be pretty greasy and salty and kind of heavy because when you think about, like,you know, rural China, you got to eat something pretty heavy cause you have to go out and, like, work in the fields for a really long time."
2314.0	2345.0	<i>Speaker 2</i>: Well unfortunately our time has come to a close, but I'd like maybe a nice round of applause for Adria Lewis and Cedric Yeh, talking about sweet and sour Chinese food in America. Don't go away because coming up is a very exciting session actually speaking of restaurants. This particular session is actually being sponsored by Busboys and Poets and the topic and key thing with our diaspora day theme is African and Asian spoken word.
2345.0	2369.57	I'd also like to call your attention that this evening at 6pm in the Moonrise pavilion right behind you should be a very exciting concert with performers Abigail Washburn and the Shanghai Restoration Project, but, please stay tuned for African, Asian diaspora spoken word and I'll turn the microphone over to my co-curator Siu-Jin Kim.
2371.0	2379.0	Thank you again to Jim, Cedric and Adriel. Fantastic session. And as Jim said, we're gonna continue the theme of diaspora now.
