start	end	original_text
0.0	20.0	{Speaker 1} [[??Unknown speaker]] The Folklife Festival, as you may know, is produced by the Smithsonian Center for Folk Life and Cultural Heritage. Our co-sponsor is the National Park Service and we are very happy to be here on the National mall, using our--this wonderful site framed by the U.S. Capitol, Washington Monument, and Museums of the Smithsonian Institution.
20.0	33.0	The festival is supported in part by federal funds, by Smithsonian trust funds, by contributions from governments, corporations, foundations, and individuals like yourself.
33.0	43.0	One way you can help contribute is by visiting our festival marketplace, which is just to the west, in front of the National Museum of American History.
43.0	48.0	We've got beautiful craft items, made by our participants from China and from Kenya.
48.0	52.0	You can also visit, if you haven't already, our food concessions.
52.0	57.0	We have a food concession directly behind you called [[?? Chinese name]]
57.0	75.0	"""Let's Eat,"" serving Mapo Tofu and dumplings Lo Mein, cucumber salad. And further to the east we have two food concessions, one from--one representing Kenyan coastal cuisine and one representing Kenyan uplands cuisine."
75.0	89.0	This particular program, China, Tradition, and the Art of Living, is produced by the Smithsonian Center for Folk Life and Cultural Heritage in partnership with the China International Culture Association, working with the China Arts and Entertainment Group.
89.0	98.0	Additional support is provided by the West Calhoun  Cultural District, the Hong Kong S.A.R. and the [[??Unknown name]] Provincial Department of Culture.
98.0	113.0	"So, we're about to begin a session we're calling ""Sweet and Sour: Chinese Food in America."" And today, Sunday June 28th is our--sorry June 29th [laughs] is our Diaspora Day."
113.0	121.0	We're very fortunate to have the support of the Smithsonian Asian-Pacific American Center.
121.0	128.0	And representing the center is Adriel Luis, who is a curator of digital and emerging media, on the far left here.
128.0	137.0	And next to me is Cedric Yeh, who is the Deputy Chair for the division of Armed Forces History at the National Museum of American History.
137.0	152.0	But aside from their roles at the Smithsonian, they also have deeper connections to Chinese food, so maybe I'll ask each of them to introduce themselves and tell us, what is their connection to Chinese food. Maybe start with Adriel.
152.0	158.0	{Adrial Luis} Hello everybody. Thank you for joining us today on Diaspora Day. My name is Adriel Luis.
158.0	169.0	I was born and raised in the Bay Area, California. My family is from Hong Kong, but our migration pattern kind of came through Mexico City.
169.0	176.0	My grandfather and great-grandfather moved there, owned a restaurant, and then eventually they moved up to San Francisco.
176.0	183.0	And then my grandfather owned a restaurant over there. And so, I kind of grew up eating really good Chinese food.
183.0	196.0	And then, I started working at Smithsonian about a year ago. Before that I was living in Beijing and that was actually the first time in, like, 3 or 4 generations that my family had actually resided in mainland China.
196.0	206.0	And so, it was just really interesting growing up eating what I thought was authentic Chinese food, and then actually getting a taste of it. And so, yeah--
206.0	212.0	{Speaker 1} And so Cederic, maybe tell us a little bit about your connections to Chinese food.
212.0	224.0	{Cederic Yeh} Good afternoon everybody. Thank you for coming out, on what's turned out to be a lovely Sunday afternoon. I was about to apologize for the D.C. heat, but it's not so bad.
224.0	241.0	As Jim mentioned, I'm curator in the Armed Forces History division because as we all know, the U.S. Army loves Chinese Food. [laughs] But, my direct connection is that I grew up in a Chinese restaurant.
241.0	248.0	You know, if you ever went to a take-out joint or something like that, you saw a little kid running around, inside and out and then around the tables. That was basically me.
248.0	255.0	And--Except I didn't know that there was a larger story to be told there. For me it was just home.
255.0	273.0	Recently I had the opportunity to begin long-range research into the history of Chinese food in America, to talk about broader issues of immigration, assimilation, and entrepreneurialship. And, that's led me here, today.
273.0	287.0	{Speaker 1} As we were preparing for this session, Cederic told me that there are more Chinese restaurants in the United States than there are McDonald's, Burger Kings, and Pizza Huts, combined.
287.0	297.0	So, the question is why is Chinese food so popular in the United States or around the world? How would--Who wants to address that first? Cederic?
297.0	310.0	{Cederic Yuh} It's a fascinating number I came across. It was one of the first things that got my interest. It's kind of an amazing number. The last time I checked the census, it was around 50,000.
310.0	321.0	If you're trying to figure out that number, everybody thinks there are Starbucks across the street from one another, two blocks away from one another. You wonder why there are so many.
321.0	325.0	There's only around 13,000 Starbucks in the world. Alright, that's just to give you an idea.
325.0	347.0	As for the question of why--you can have that many restaurants, that's been part of my study for the last 3 or 4 years. There's no direct answer why the popularity, but some of the idea is this: it's always been affordable, it's always been something that people could get a full meal--a whole, full meal for your family for $20.
347.0	357.0	It's always been, at least in the early stages, exotic. It gives people a sense that they're trying something from far away. But lately it's become something more predictable.
357.0	360.0	It's something that we all understand. If you're moving from one coast to the next, you don't have anything in your house, you know you can ring up the local Chinese place and you know what you can order.
360.0	373.0	It's pretty much the same. There's appetizers on the left, main courses in the middle, and then on the right side of the fold they're probably going to have some American dishes.
373.0	386.0	And you probably know what they are. So, it's reached a saturation point where everyone feels comfortable with it. And it helps generate its own form of momentum--forward momentum.
386.0	394.0	{Speaker 1} Adriel what are your thoughts on this? Why is Chinese food so popular, either in the United States, around the world, or perhaps--yeah, please.
394.0	412.0	{Adriel Luis} You know I think a lot of people think about cuisine and restaurants coming from a consumer standpoint. I think one of the things about Chinese restaurants is that they're not always necessarily started by people who have a background in cuisine.
412.0	428.0	And so, when you think about immigration from China and people landing in and what are some entry-point businesses they can open up, the ones that kind of ended up sprouting up among Chinese communities were restaurants and laundromats.
428.0	442.0	And so, I think part of was almost--just being [[??Unknown word]] restaurants first and then at that point the availability kind of gets people to want to try it out.
442.0	449.0	You know, I mean, if you come to a city, and you've just got like a row of Chinese restaurants and you're hungry, then you're just going to try one out.
449.0	464.0	And so, when you think about the diaspora of Chinese people, especially in the United States, you can go to really small towns--I've been to college towns where you can pretty much find like, two dive bars and then like, a Chinese restaurant.
464.0	479.0	And, I think it's almost become a thing where--people in the US find it to be comfort food. You know, like [[?]] said if you can't find a chain-- I think Chinese cuisine is one of those things that there not necessarily connected to a chain.
479.0	488.0	But, you still have this common menu that you know when you get there, there's going to be certain dishes. And they happen to be dishes most of the time, that were invented in the US.
488.0	498.0	And so, I think part of it is also American Chinese cuisine is one of those cuisines that was formulated and that caters around an American palette specifically.
498.0	508.0	And then so, you have that kind of spread in the US and then as American culture spreads throughout the world part of that is the American Chinese cuisine.
508.0	524.0	Just as an aside, and keeping in tune with my armed forces history background-- as a little factoid-- being in D.C I meet a lot of foreign aid and military types.
524.0	538.0	The first two restaurants apparently in the green zone in Iraq were Chinese restaurants! So you know, they weren't American Chinese restaurants they were just--entrepreneurial Chinese families. But they probably heard that Americans like Chinese food.
538.0	553.0	Yeah as I mentioned, today at the folk-life festival is diaspora day. And one of the-- I think interesting trends about Chinese restaurants is that, you could almost use it as a timeline of immigration patterns.
553.0	564.0	So who would like to sort of talk about that? I mean how do Chinese restaurants-- those straight patterns of migration, immigration and diaspora.
564.0	585.0	Well, following what [[?]] just said about Chinese restaurants being one of the only means-- as a possibility of immigrants coming in this country. There's a story behind that there's a reason behind that, because when the earliest Chinese immigrants first arrived they came just like everyone else did, looking for an opportunity.
585.0	601.0	They started many different jobs, they were farmers, they were-- they worked on the railroads, they were miners. They had a lot of different professions but as time went on, the differences-- their otherness, the fact that they did not blend in well with the community.
601.0	616.0	They earned growing mistrust from the west coast communities, that eventually led to exclusion laws that barred more Chinese coming into the country and made it increasingly more difficult for them to do those normal jobs.
616.0	628.0	So, one of the few things they could do was restaurants or laundromats-- things that didn't infringe upon other community activities, that didn't feel threatening. I mean if you didn't want to eat their food you didn't have to go in there.
628.0	654.0	So,that's basically how that started and it continues to this day, because it's become a large part of-- the fabric of the American experience, in this countries eating habits is that when new Chinese immigrants come here. Even if they don't fit the bill, if they weren't in the restaurant business before they could be-- highly trained highly educated people who have not but know they're gonna end up working in a restaurant because that's what's available to them.
654.0	685.0	And the story follows, as you mentioned, a timeline that involves the end of the exclusionary laws around World War Two. What happened between there is a fascinating story and then of course, the next big spike is the 1965 immigration law changes. Revolutionized the ability for immigrants coming to this country from all over the world -- brought new tastes, new flavors, including some of the more popular dishes that you've probably heard from Szechuan and Hunan.
685.0	700.0	It's all pretty average now, but at the time it was unbelievable. Nobody had heard of this, it was just the influx of these new flavors, and that's around when my parents came to this country too, is during, right after the changes in those laws.
700.0	706.0	Yeah Adrio(?) do you want about this idea of migration, diaspora, and Chinese restaurants.
706.0	753.0	"Yeah. We got like a soundtrack now, I feel like, so Chinese right now, talking with this. So, well, one of the interesting things about the popularity of Chinese restaurants is that, the history of Chinese food in America was so much the opposite of what it is now. Like, one of the tactics dur--  so, in the late 1800s, there was a Chinese expulsion era. Chinese people as an ethnicity, we're the only ethnicity where there was actually American legislation where there was a law that specifically was like, ""We don't want Chinese here!"" right. And around that was also a lot of propaganda, cultural propaganda. One of the things in the late 1800s was that, you know like, we don't want these Chinese people here, all they eat is rats, cats, and dogs."
753.0	786.0	Fortunately, those stereotypes no longer exist, right. And so, like, that was one of the reasons why Chinese restaurants in America were very insular. In the late 1800s, early 1900s, if you went into a Chinese restaurant, you would only see Chinese people there and the dishes were catering mostly just to Chinese folks, and so, even here in DC you would have Szechuan restaurants, Hunan restaurants, Hong Kong restaurants, and they all had their own distinct regional cuisines.
786.0	809.0	"And then, you have President Grant, right. So the story of President Grant is, he had the Chinese Prime Minister over and the Prime Minister brought his personal chef. And so throughout the trip they're eating a bunch of American food, and then one day, you know they're like, ""You know, you have your personal chef over, why don't you try cooking us some Chinese food to eat?"" right."
809.0	827.0	"And the chef is like, ""I'm in DC, I'm not gonna find the ingredients to make some Chinese food"" right. And so he just, like, put together a bunch of random ingredients and then served it to, like, the White House. And then they ate it and they're like, ""Wow, this is delicious, what is it?"""
827.0	838.0	"And then the dude was like, ""Uhhh chop suey"" right. And then so, they're like ""Wow!"" and then, so like, word spreads, right. All the presses go out like, ""Oh the President is eating Chinese food now"" right."
838.0	852.0	"And then, so, people all throughout DC started going to these Chinese restaurants like, ""Hey, do you serve chop suey?"" And then these restaurants owners, you know, for the first time are getting non-Chinese customers and they're not gonna be like, ""No,"" so they're like, ""Yeah, yeah, we make chop suey."""
852.0	883.0	And so like you have all these different variations of chop suey spread throughout the US and so, you have these dishes like chop suey, egg foo young, beef and broccoli, sweet an--. Probably like most of your favorite stuff that you would get from like the hot plate thing at Panda Express. It comes out of this, similar stories where these Chinese entrepreneurs are kind of testing what are the different tastes that America, Americans are kinda going for.
883.0	898.713	And you have this negotation like Cedric was saying, you know like, what can we make so that people in America will be like really into it, but at the same time they'll feel like they're eating something all like, exotic right. And then so you end up with just like, meat covered in, gravy, which is very American when you come to think of it.
901.0	914.0	<i>James Deutsch</i>: Yeah, well the other, other part of chop suey and egg fiang is also fortune cookies, right? I mean fortune cookies are very popular in Chinese restaurants, do they have any relation to actual Chinese cuisine?
914.0	921.0	<i>Cedric Yuh</i>: Um yeah if you haven't heard yet I'm sorry to tell you, no. Um, haha.
921.0	943.0	Uh, fortune cookies are a wholly American invention, but, There are Asian influences. Um, I hesitate to use the word 'recent studies' but there is a lot of evidence that shows that the fortune cookie derived from a prefecture in Japan where they have a larger jumbo version of it, it's kind of like a big croissant.
943.0	962.0	The gentlemen who has a claim to creating it here in the States was from that prefecture and when he landed in San Francisco he wanted to have something to go along with tea in the afternoon, he had a teahouse, or at least he owned a restaurant in a tea- tea garden and so he made a smaller version of the fortune cookie.
962.0	975.0	Now the magic question is how does the fortune cookie end up as part of our expectations for an everyday Chinese meal if it was invented by a Japanese man.
975.0	983.0	Um, there's no real um, smoking gun. The idea of when it started being served in Chinese restaurants we don't really know.
983.0	999.0	How it started being the transfer from a Japanese creation to a Chinese one-- more than likely, the theory that I have, during World War II almost- every single Japanese American, or Japanese of American, uh-
999.0	1009.0	Americans of Japanese ancestry were shipped off to internment camps. There were, it's a long story. But that meant that everything they had, their businesses their factories, gone- empty.
1009.0	1026.0	And the thought is that the Chinese then moved in, they're entrepreneurial, they started running the places keeping the businesses going and that led to the restaurants there were already beginning to boom.
1026.0	1033.0	Um, and then those were big ports, the war was going on, you have a lot of GIs from across the United States flooding through those areas, they stop for that little like,
1033.0	1042.0	"""Hey there's a row of Chinese restaurants I'm gonna stop in, they gave me this fortune cookie, and amazingly, you know I don't know what you think about the taste of it but it's got a little fortune inside. You know oh my God who does that?"""
1042.0	1048.0	"And they go home to wherever they're from and they ask their local restaurant ""where's my fortune cookie?"" after they're done."
1048.0	1058.0	"And they look at them and they say ""I, I, I have no idea what you're talking about."" Same thing with the chop suey and eventually people get it, you-- that's what you want, think about it it's free!"
1058.0	1067.0	I mean what other restaurant ends your meal with - I guess you can get a mint or maybe like an orange wedge, but that's not the same thing. You get your fortune! My God.
1067.0	1102.0	<i>Adriel Luis</i>: Yeah I mean I think that - just to add onto that - like definitely when it comes to Chinese food in America it oftentimes really like comes less from a culinary, kind of like- you know food-based standpoint, and more of just like hustlers. Just being like what are people going to buy? What is going to make my business thrive, so a lot of Chinese food derives from an entrepreneurial standpoint, and then, as a result, Americans have become so accustomed to the taste that it just... People grow up eating it and wanting it.
1102.0	1130.0	<i>Cedric Yuh</i>: Not to knock our love of Chinese food. I don't want anybody to think that - I'll say it a different way: It's an interaction between those Chinese restaurant owners It was the only way of living, for a good 65 years. They had almost no choice but to open up restaurants and if that was your only job, then you're going to try and develop ways to interact with the community. That's the keyword: interact
1130.0	1172.0	"They did not, as some people would say, I am not necessarily of the [[camp?]] that said that this is, um, that there's something less about Chinese food as we know it today because it's not authentic. I mean, it is very much American, I don't like to add any hyphens after it. They did not meet those immigrants when they came off the boat in 1850 and say ""Give me all your recipes"", and then for the next 100 years they messed them up, and then they gave them back recently and said, ""Haha what are you going to do?"". It was a constant interaction between the customers and the owners of those restaurants to create something that would sell, that you would enjoy and it's a part of all of our stories."
1172.0	1211.0	<i>James Deutsch</i>: For those of you who have just recently joined us, this is a session recalling sweet and sour Chinese food in America and with us are Cedric Yuh from the Smithsonian National Museum of American History and Adriel Luis from the Smithsonian Asian Pacific American Center. Adriel you were telling us, or you were telling me earlier, telling us earlier, that you recently lived in Beijing before coming to the Smithsonian and you've noticed that some of the restaurants in Beijing may be adapting or transforming based upon American style Chinese food. Could you share some of your thoughts about that with us?
1211.0	1359.0	"<i>Adriel Luis</i>: Yeah so, um, so I, I was living in Beijing before I moved to DC and, um, I've had a harder time finding good Chinese food in DC than I had finding good food American food in China. uh, but, I was living, I was living in the third ring uh, in an area that is heavily ex-pat. Actually, when you look out the window there's like a pizza spot, a pasta spot, a brick oven pizza spot and like KFC. KFC is everywhere, hella KFC's right. And so, I had trouble finding Chinese food in my neighborhood actually, I had to hop on a train, kinda like in DC. But, you know, I think one of the interesting things, especially in these ex-pat areas, is that you have like this meta Chinese food, which is, because you have a lot of foreigners living in the neighborhoods that move to China and get freaked out by real Chinese food and they're like ""Where my orange chicken?"". They start cooking orange chicken up in China, right? And so you would go to these places where uh they would, they would serve the Chinese food that, you know, so, so typically like you would get a good meal in China of like real delicious clean Chinese food for like, maybe like, four or five bucks, uh, US dollars, but you would go into these really fancy restaurants they would sit you down and then uh, and then, and then you can order sweet and sour chicken for like fifteen US dollars, right, and uh, yeah it was like American style Chinese food uh, cooked by Chinese chefs who grew up cooking actual Chinese food and so it kinda tasted a little better than American Chinese food but at the same time it was weird yeah because you uh yeah you know you get your fortune cookie at the end, you know like they decorate it all like you know, with these lanterns and things like that, which you know, you actually don't get when you go to a local Bejing reustaruant, and so, it's, it's really interesting because I think on New York times they were writing an article about, now there these restaurants that are actually marketing themselves and ya know, you have these, now, now, you have these Americans, uh, moving to China because they spent some time living in China, uh now moving back to China, and then creating American-Chinese food, for Chinese people who want to eat like the ex-pats and so their going to these American-Chinese restaurants in China ordering American-Chinese food so that they can eat like the foreigners that they see eating it."
1359.0	1386.0	I recently gave an interview for the national china daily because--panda express is opening their first restaurant there, so that's fantastic! And another factoid, you know they tried marketing-- exporting fortune cookies back in the '80s but that failed miserably because no one understood why their cookies had species of paper inside. The locals were just confused and stopped buying them.
1386.0	1392.56	<i>James Deutsch</i>: Well, I'm sure members of our audience have questions they would like to ask our panelists. Yeah, Randy?
1403.0	1412.0	{James Deutsch} Yeah, the question is for the Chinese American's who've been living here a long time do they prefer Chinese American food, Chinese food or perhaps some combination of the two?
1412.0	1416.0	[quiet background noise]
1416.0	1422.0	{Cedric Yeh} It's the same for any immigrant group; they like the food from their own countries.
1422.0	1429.0	So yes, as I am sure everyone will attest to back home, they cook whatever it is that they're used to.
1429.0	1433.0	So as children of immigrants, I'm a first generation kid, I ate what my parents ate.
1433.0	1438.0	But that changed after a while because there is only so much that working parents can do for a kid
1438.0	1442.0	and I ate like anyone else growing up I had hot dogs, hamburgers and my parents learned.
1442.0	1446.0	But my Grandfather, who was born in the Qing dynasty, I remember him taking me to have my first McDonald's.
1446.0	1456.0	You know it's any other immigrant's story there is no, the line is pretty much the same, where ever your folks are from they will prefer to eat home cooking.
1456.0	1461.0	{Adriel Luis} Yeah, I mean so my parents are both from Hong Kong and when I was a kid,
1461.0	1467.0	you know like, I grew up in the Bay Area and so there were Chinese restaurants like down the street, you know 5 minute drive away,
1467.0	1474.0	"but sometimes it'd be like Thursday night and they'd be like, ""We're gonna get Hong Kong food!"" and then we'd drive for like an hour and 45 minutes."
1474.0	1476.0	"When I was a kid I was like, ""Why we driving so far?"" right?"
1476.0	1481.0	"Now after I've spent some time living in China, I'm like, ""That's why."""
1481.0	1490.0	Because it's so much better and they would like, miss it and um yeah it's like sometimes you'll, I mean, same thing in Virginia and Maryland;
1490.0	1494.0	like sometimes you might come across like a Chinese restaurant or any other kind of Asian restaurant
1494.0	1499.0	like that's like really into [[??cuts]] like there's no way that you woulda just stumbled upon it
1499.0	1502.0	and then you see it and then it's just like filled with people
1502.0	1506.0	and it's like how do you, like you know, that's kinda like the word of mouth
1506.0	1519.0	and its like the folks who grew up eating really authentic Asian food when they find a spot that kinda fits it as closely as they can, like they'll gravitate towards it, tell all their homies
1519.0	1523.0	yeah know like, it's like we've been doing Yelp before the internet. So --
