start	end	original_text
1302.0	1477.85	"So for both of us, it's been very, very rewarding. 
<i>Speaker 3</i>: So I mean, so what is the aura about Chinatown that makes Chinatown a Chinatown? You know, as, so, you know, what is it? We're talking a lot of intangibles here, seems, like, you know, a lot of real stuff too, but a lot of intangibles, would you say that, agree with that, Ted? 
<i>Speaker 4</i>: yea, so, so I hope that there is, actually I hope other people can contribute to my experiences as well. The idea of a Chinatown is, is where,  I remember one time somebody asked me, he says, ""why should we..should we or should we not preserve Chinatown?  This is actually a Boston Urban Planner, a Chinatown Urban Planner, he says, ya know that's a philosophical question if you ask me how do we preserve Chinatown in terms of how do you do the traffic flows and how do you do the buildings and the constructions and the sights and so forth, well, that's a question I can answer as an engineer or a designer. But if you ask me should we or should we not preserve Chinatown, then that's a philosophical question and I'm not sure all of us have the right answer to that.  Another person said to me, I says, Chinatown is where the Chinese people are. If that's the case, then if you use the D.C. example then there are not that many Chinese residents physically, people living in Chinatown many more are moving toward Rockville, everybody knows that.  If you are talking about where the food is, there are good Chinese restaurants in Chinatown there are others and even more in other places...in Maryland and different places of this sort. In New York you talk about not just one Chinatown on Mott Street, you talk about three or four Chinatowns because the different congregations of people and the restaurants have moved. In Philadelphia, the restaurants have moved and so forth and so on.  So what is it that makes Chinatown, Chinatown and where things are?  Think about it again. Right now, there are more Chinese festivals being done in urban areas where you have these big festivals being done say at Tyson's Corner or Oak or at one of the malls.  They have these great dances all day long for Chinese New Year or Ching Ming and you would go there and everybody would celebrate those things and learn a little bit and eat a little bit and learn a little bit more about Chinese culture. But you would never say that Tyson's Corner or Fair Oaks mall is Chinatown.  You would never say that, right? And you would have a hard time saying just because there's a concentration of people in Rockville, that Rockville is Chinatown. There's something about that term Chinatown in these historical Chinatowns that makes this what it is and I'm not sure what it is."
1493.0	1654.52	"[ The speaker is being asked a question but I cannot understand it] 
<i>Speaker 1</i>: yes, yes, So, but at the same time, he is saying, that how do you keep a Chinatown in the country in a country that is as diverse as the Unites States is. That raises another interesting question.  Everybody else, other ethic groups have their own barrios, their own fisherman's wharf or something of this sort. Should all those places be preserved separately as we grow.  As we grow, we remember  that I was raised in say, a part of New York City, but I don't necessarily want to maintain that area.  If I were raised in the projects in Detroit, that's defined my character and stuff, but I don't necessarily want to preserve that, that building, right.  But why is it then that we want to preserve that Chinatown area? Do we have any answers to that? 
<i>Speaker 2</i>: Yea, who has answers to that?  My own answers somewhat, I agree, it's hard when to answer. But, ya know, I'm saying that what I read earlier, is that Chinatown has its own deeply felt history and stories of national, cultural significance and I think one thing about Chinatown is it was a protective area for us as opposed, this is where we had to be and I think there's lots of stories there that need to be preserved. If not, the structures themselves, then the stories that go behind why were Chinatowns there.  I think that's an important history lesson for all of us in this country to know about.  Why did the Chinese population retreat into these Chinatowns? And they got the reputation..it's not because they wanted to per say, but they were kind of forced into that area and they persevered there and I think that's how they became a stronger community it made for a sense of community and I think that kind of history is there.  I don't know if you disagree or not agree with me Walter... 
<i>Speaker 1</i>: Part of the community part of it is the community, the current community there, the historical community, but part of it is sort of the Hollywood myth of Chinatown. You know, you have Chinatown movies you have, everybody, you talk about the for better or worse, whether it's the stereotype of the underground tongs or the other stuff like this.  Chinatown evokes an image that I think other, other ethic communities necessarily evoke and it's both positive and negative for Chinese Americans, yeah."
1659.0	1691.0	<i>Speaker 1</i>: [[??]] and culture {SPEAKER name=Woman} I grew up in Oklahoma, just like you guys where there is nobody else and just that sense of going back and going to a place where historically Chinese [[??]] and you see where perhaps [[??]] and so I think thats, it's something that you might could find in a history museum [[??]] you don't have that same sense of feeling or real culture.
1691.0	1724.0	<i>Speaker 1</i>: Speaker 1: Wh-wh-why is that? So, one of the things she's saying is that, growing up in Oklahoma, you come back much like Stan is saying, or Walter is saying, you come in and suddenly you surround it by, uh, things that your parents, or grandparents, all that kinda stuff that kinda happens. And that gives you another sense of uh, a part of your identity and history. But why is it that, you get that from a chinatown, and not from , say, going to the Chinese historical museum in New York, or the Angel Island Museum, in... Why is it that it's a Chinatown, that-that does that? That place..
1724.0	1778.0	"{SPEAKER name=""Speaker 2} Speaker 2: Y=You know, I think it's just an aura there, th-th-that does that, 'cause I-I-I agree that what you're saying there because, y'know, I don't speak Chinese, y'know, so, y'know, so people say they go to China so they can hear people speakin' their same language- I don't understand a word that's being said there- b-by Chinese people there. Since, so, y'know, and I- like I said, I ran away from my Chinese heritage. S-So I really.. Don't identify, but somehow, when I'm there, y-y'know, I feel like, ""Hey, stay in your home"". Uh, and, and, y'know, I use the term, it's a cultural touchstone for me. Uh, in my personal journey and I think that resonates with a lot of people like me who've had who've kind of run away from their identity or are not sure what their identity is because the duality that we, Chinese Americans face in this country you know living especially second generation people like us."
1778.0	1780.0	{SPEAKER name=man in background} third generation, fourth generation.
1780.0	1883.91	<i>Speaker 1</i>: yeah, yeah I think for those who Chinese Americans who are born here you know we may tend to view Chinatown more as in the abstract as something that has enduring meaning, I think it does because it is a part of our history and so forth but I think there is another level that is much more basic and I think that is for the immigrants that come they seek comfort in like kind languages and other people who have had experiences just like them and so it to me it's it's very very basic really. It's security for immigrants who've come and I think when you find someone who is sharing somewhat the same experience that you are about to embark on it provides a tremendous amount of comfort and security so even in D.C. Chinatown when we look at it we may find that it seems to be relatively small but really for the people who live there the newly arrived immigrants I think it means so much to them and I think we see that in our interaction at the Chinatown service center, the immigrants that come in for help sometimes they just something very very simple they come in just for translation, they get something in the mail and they don't know what this is so you can. I think what we always try to do is put ourselves in an immigrants place, imagine if you were to go to China and know not a word of Chinese and then how would you cope? And so I think that is the attitude that we take when we assist immigrants who come to the Chinatown service center seeking help.
1887.0	1898.0	<i>Kirk</i>: It sounds like what you all are saying is that the physical Chinatown keeps getting smaller in many places, Washington included.
1898.0	1910.0	Do you have any thoughts on how we can preserve Chinatown and maybe not just the physical, but perhaps also the histories that you're talking about, the cultural histories?
1910.0	1921.0	"{Unknown Background Speaker}: Good question. 
<i>Speaker 1</i>: That's a real toughie Kirk uh you know as you ask, how do we ask the question I really want to present here as sort of our assignment, you know, how do we do this?"
1921.0	1929.0	How do we maintain - cause you're not going to--we're not, you know-- DC Chinatown is not going to have a lot of residents again, you know,
1929.0	1941.0	Like San Francisco where you're selling fish on the open market there and things like that and a lot of people living there and speaking the language in Chinese and dialects and so forth,
1941.0	1957.0	So that's a hard one to answer, you know, how do we preserve this feeling here and preserve this- most of all- the history that's been there and of the people who lived there, played there, laughed and cried there - the whole thing?
1957.0	1965.0	{Speaker 2}: So part of it is, you have to maintain the physical appearance of the town, the boundaries that define it,
1965.0	1974.0	whether it's the architecture, the little-- whether or not they're bona fide architecture is another question-- but there's something that allows it to be distinct.
1974.0	1987.0	So in DC Chinatown for example, shops have to have Chinese characters on their windows, right? And so, those kind of things seem superficial, but they are still important enough to help define that space.
1987.0	1996.0	And what you do in that space is important, what are the activities that you do there? Do you allow the family associations to continue to operate there?
1996.0	2005.0	Does the city give it enough--the family associations were talking very much about the [[??]] Association, the [[??]] Association, [[??]], and things of these sorts.
2005.0	2021.0	These things don't have the original purpose that they had in the sense that, everybody had to go through them because nobody else spoke Chinese, Chinese did not speak English, and they did a lot of extra, or judiciary, or sort of semi-judiciary types of functions.
2021.0	2038.0	But they are still important because they are gathering places to help the person identify what they do. Chinese Consolidated Benevolent Association still represents thirty-some odd associations of Chinese people and organizations - they do annually the Chinese New Year parade.
2038.0	2044.0	Those type of things are important still to do, and we should have the city- and continue to encourage that.
2044.0	2054.0	The buildings space doesn't have places that are museums that allow us to preserve and tell the stories which [[??]] is talking about.
2054.0	2063.0	So if the people are--have gone there, and live there, and have a story to tell -- we ought to have a way to preserve it.
2063.0	2083.0	And then to--once we preserve it-- to tell it so that the next generation or other people, not just next generation Chinese, but other people that are passing through Chinatown know that there are stories created in Chinatown that represented the Chinese identity, or diaspora that happened to be in DC.
2083.0	2086.8	Um, you had another question? {Unknown Speaker 2}: Yeah--
2098.0	2099.0	<i>Speaker 1</i>: Yes
2099.0	2135.0	<i>Speaker 2</i>: And as gentrification has occurred in Chinatown more and more of the Chinese businesses are getting bought up but it's like, it's like the burger joints and whatnot with Chinese lettering. My question to you is do you, is there a fear that with time and with Realestate properties going up that eventually small Chinese businesses in Chinatown will get bought up? You know it is looking very [[??]] and certainly it is a lot more secure than what you see before but how do we keep Chinatown Chinese?
2135.0	2222.0	<i>Speaker 1</i>: Correct. And so one of the issues there, that very much is on top of everybody's mind. If you think about Chinatown and what makes it it's the individual entrepreneurs, the mom and pop shops, the little things like that that sell the [[??]] and the all that kind of stuff that we think of as comfort food as you gentrify the prices go up, there is no way to stop the city from raising the taxes and so for like this. And at a certain point those people that operate those businesses like my mom and dad, they are getting old and quit frankly they worked really hard to get you in college so you can get that law degree right? And you are not going to go back there and run the place so those are very real practical questions to look at and some of the things that us that are looking at property uh the development of China how do we encourage something like that there recognizing that economically we may have already passed, it's already gone by right? So, so I'm not sure what the real answer is to that, it could be city, maybe the city has to produce some kind of, of tax incentive that allows these things to stay. But, do you really want to do that, do you really want to encourage a small business that doesn't, that doesn't really make itself productive or do you have an ordinance that say there should be Asian related or Chinese? Those are all questions for us [[??]].
2222.0	2264.0	my feeling just to finish off is that I think, I think  what we many people focus on the small shops because we like the mom and pop. I would like to see big banquet facilities because if you have a banquet there it allows us to do those things that make our Chinese life significant. The wedding, the, the [[??]], the Ching-Ming festival or something where you bring your family there. You have to create so, it's not so much that small definition of a shop but it is a Chinese sort of setting that allows you to carry on your family traditions and your activities.
2264.0	2269.0	<i>Speaker 2</i>: Yeah. So, we'er almost at the end of our time so we got closing comments here.
2269.0	2286.33	{SPEAKER name=woman} uh yeah I um I agree that it is difficult to have small business it's just not profitable um also I think housing is also a problem. Thats why people can't afford to live there. We have all these expensive condominiums
2288.0	2306.0	{SPEAKER=Woman} Unless you have, you know, a high income. It seems impossible. So, but we do have people who do want to live there. They want to raise their families there. And there's no affordable housing. And low-income housing seems to be disappearing too. So, there's all sorts of problems and I really don't know what can be done, really.
2306.0	2376.0	<i>Speaker 1</i>: Yeah, my fear is that what we're going to end up having in DC—because of the gentrification and so forth—is that what we're going to end up having is a commercial Chinatown. Where we have very few residents living there. And that would be a real shame, really. I think in Las Vegas, they have what they called a Chinatown in a mall. To me, that is not a Chinatown, really. And I think it's incumbent upon the city to provide affordable housing. Right now, there's 3 billion affordable housing and one looks like it's on the chopping block. Because it's such a hot area, they want to turn that into a condominium. So, I don't really know what the answer is basically. I think at the very least what we need is an infusion of capital with... We have the foot trafficking area. The area is really a hot area now. But we need some entrepreneurs with some Chinese connections who's willing to invest in the area. Right now we have businesses like Panera, Starbucks, they're all coming in. But the Chinese entrepreneurs, I think, are unwilling to make the investment.
2376.0	2497.85	<i>Speaker 2</i>: Okay. Very good. I think I agree with all that. One point that I did want to emphasize on yours that, you know, I certainly don't want it to be a commercial Chinatown. None of us want a Disneyland atmosphere there for tourists to come in and gawk at the Chinese people there. And that's not a Chinatown. We want it to be meaningful. I think what they're saying is right. We're going to have help from the city planners to bring in the right businesses and make the right conditions there to make it work. [Clears throat] Excuse me. So, coming to the end here. So, again, I want to read again from this quote here 'cause I think it's very significant that what Bonnie Tsui says in his book here, says: The myth of America lies in its patchwork heritage. Though the United States hasn't always tolerated difference, it continues—to this day—to be built by immigrants. This contradiction in founding myths led to an ethnic awakening: the birth of cultural pride is still evolving. Visitors of Chinatown have a role—we all have a role—just as residents do in a bartering of culture currency. If there's authenticity to be experienced, it's that of an immigrant enclave that continues to be vital. This is a reminder of what makes America special. After a century and a half of Chinese immigration, Chinatown is still the first step for new immigrants into America and for American-born Chinese into their Chinese heritage. And so, thank you all for your attention today. And I thank Ted, Walter, and Shirley for their participation here. And really, I said you guys got your assignments today. You helped us out. Helped us with Chinatowns. You know, make it work for us. Make it work for you too. Thank you.
2507.0	2539.92	<i>Speaker 1</i>: Yeah uh, don't go too far away because starting in just a few more minutes we'll have another panel discussion, this one entitled Young Historians Living Histories. So starting in a just a few minutes as we get set up, Young Historians Living Histories. Yeah no, we're moving onto the next one. So I'd like to welcome you to day Number Five of the 2014 Smithsonian Folklife Festival. Today is diaspora day and that's diaspora day both for
